[
  {
    "action_space": "finite registered search actions",
    "agent_count": 8,
    "budget": "registered finite action budget",
    "communication_permissions": "task-family declared messages only",
    "compatible_protocols": [
      "blind-distinct",
      "pooled-planner"
    ],
    "coverage_function": "union discovery",
    "evaluator": "exact",
    "evidence_channels": [
      "conditionally independent declared channels"
    ],
    "expected_metrics": {
      "blind-distinct": {
        "discovery": "1/2",
        "distinct-actions": "8"
      },
      "pooled-planner": {
        "discovery": "860391662035297/1001129150390625",
        "recovery-budget": 7
      }
    },
    "feedback": "none",
    "observables": [
      "discovery",
      "distinct-actions",
      "recovery-budget"
    ],
    "per_agent_information": [
      [
        "declared private observation"
      ],
      [
        "declared private observation"
      ],
      [
        "declared private observation"
      ],
      [
        "declared private observation"
      ],
      [
        "declared private observation"
      ],
      [
        "declared private observation"
      ],
      [
        "declared private observation"
      ],
      [
        "declared private observation"
      ]
    ],
    "prior": "registered exact rational prior",
    "private_objective": "registered private payoff or protocol control",
    "public_status": "golden",
    "reference_claims": [
      "DD-C-0003",
      "DD-C-0006",
      "DD-C-0008"
    ],
    "reference_runs": [
      "20260720T190336Z_DD-000_32dd1c32_217c602fa0",
      "20260721T012208Z_DD-000_8e4b55e2_e8321d1048"
    ],
    "report_message_space": "finite registered message space",
    "reward_rule": "common discovery objective",
    "schema_version": "discoverybench-task-v2",
    "seed_policy": "no randomness beyond exact model integration",
    "social_objective": "registered discovery or net-value objective",
    "source_choice_permissions": "task-family declared source choices only",
    "source_dependence": "conditionally independent declared channels",
    "target_law": "registered finite target law",
    "task_family": "canonical-atomic-boxes",
    "task_id": "DB-G01",
    "timing": "simultaneous",
    "world_space": "finite registered world"
  },
  {
    "action_space": "finite registered search actions",
    "agent_count": 2,
    "budget": "registered finite action budget",
    "communication_permissions": "task-family declared messages only",
    "compatible_protocols": [
      "ex-ante-role-policy"
    ],
    "coverage_function": "union discovery",
    "evaluator": "exact",
    "evidence_channels": [
      "conditionally independent declared channels"
    ],
    "expected_metrics": {
      "ex-ante-role-policy": {
        "discovery": "7/10",
        "protocol-loss": "0"
      }
    },
    "feedback": "none",
    "observables": [
      "discovery",
      "protocol-loss"
    ],
    "per_agent_information": [
      [
        "declared private observation"
      ],
      [
        "declared private observation"
      ]
    ],
    "prior": "registered exact rational prior",
    "private_objective": "registered private payoff or protocol control",
    "public_status": "golden",
    "reference_claims": [
      "DD-C-0021"
    ],
    "reference_runs": [
      "20260720T200447Z_DD-001_6eb12861_ba766d1eba"
    ],
    "report_message_space": "finite registered message space",
    "reward_rule": "common discovery objective",
    "schema_version": "discoverybench-task-v2",
    "seed_policy": "no randomness beyond exact model integration",
    "social_objective": "registered discovery or net-value objective",
    "source_choice_permissions": "task-family declared source choices only",
    "source_dependence": "conditionally independent declared channels",
    "target_law": "registered finite target law",
    "task_family": "private-team-role-counterexample",
    "task_id": "DB-G02",
    "timing": "simultaneous",
    "world_space": "finite registered world"
  },
  {
    "action_space": "finite registered search actions",
    "agent_count": 8,
    "budget": "registered finite action budget",
    "communication_permissions": "task-family declared messages only",
    "compatible_protocols": [
      "private-clue-following"
    ],
    "coverage_function": "union discovery",
    "evaluator": "exact",
    "evidence_channels": [
      "conditionally independent declared channels"
    ],
    "expected_metrics": {
      "private-clue-following": {
        "discovery": "325089/390625",
        "protocol-loss": "0"
      }
    },
    "feedback": "none",
    "observables": [
      "discovery",
      "protocol-loss"
    ],
    "per_agent_information": [
      [
        "declared private observation"
      ],
      [
        "declared private observation"
      ],
      [
        "declared private observation"
      ],
      [
        "declared private observation"
      ],
      [
        "declared private observation"
      ],
      [
        "declared private observation"
      ],
      [
        "declared private observation"
      ],
      [
        "declared private observation"
      ]
    ],
    "prior": "registered exact rational prior",
    "private_objective": "registered private payoff or protocol control",
    "public_status": "golden",
    "reference_claims": [
      "DD-C-0038"
    ],
    "reference_runs": [
      "20260721T022739Z_DD-001_358cb1eb_cd16846ba5"
    ],
    "report_message_space": "finite registered message space",
    "reward_rule": "common discovery objective",
    "schema_version": "discoverybench-task-v2",
    "seed_policy": "no randomness beyond exact model integration",
    "social_objective": "registered discovery or net-value objective",
    "source_choice_permissions": "task-family declared source choices only",
    "source_dependence": "conditionally independent declared channels",
    "target_law": "registered finite target law",
    "task_family": "canonical-private-team-optimum",
    "task_id": "DB-G03",
    "timing": "simultaneous",
    "world_space": "finite registered world"
  },
  {
    "action_space": "finite registered search actions",
    "agent_count": 2,
    "budget": "registered finite action budget",
    "communication_permissions": "task-family declared messages only",
    "compatible_protocols": [
      "consensus"
    ],
    "coverage_function": "union discovery",
    "evaluator": "exact",
    "evidence_channels": [
      "conditionally independent declared channels"
    ],
    "expected_metrics": {
      "consensus": {
        "discovery": "5/9"
      }
    },
    "feedback": "none",
    "observables": [
      "discovery"
    ],
    "per_agent_information": [
      [
        "declared private observation"
      ],
      [
        "declared private observation"
      ]
    ],
    "prior": "registered exact rational prior",
    "private_objective": "registered private payoff or protocol control",
    "public_status": "golden",
    "reference_claims": [
      "DD-C-0030"
    ],
    "reference_runs": [
      "20260720T225848Z_DD-002_94607423_e29b1460ae"
    ],
    "report_message_space": "finite registered message space",
    "reward_rule": "common discovery objective",
    "schema_version": "discoverybench-task-v2",
    "seed_policy": "no randomness beyond exact model integration",
    "social_objective": "registered discovery or net-value objective",
    "source_choice_permissions": "task-family declared source choices only",
    "source_dependence": "conditionally independent declared channels",
    "target_law": "registered finite target law",
    "task_family": "deterministic-disclosure-fixture",
    "task_id": "DB-G04",
    "timing": "simultaneous",
    "world_space": "finite registered world"
  },
  {
    "action_space": "finite registered search actions",
    "agent_count": 2,
    "budget": "registered finite action budget",
    "communication_permissions": "task-family declared messages only",
    "compatible_protocols": [
      "anonymous-market"
    ],
    "coverage_function": "union discovery",
    "evaluator": "exact",
    "evidence_channels": [
      "conditionally independent declared channels"
    ],
    "expected_metrics": {
      "anonymous-market": {
        "discovery": "171/308",
        "protocol-loss": "1/2772"
      }
    },
    "feedback": "none",
    "observables": [
      "discovery",
      "protocol-loss"
    ],
    "per_agent_information": [
      [
        "declared private observation"
      ],
      [
        "declared private observation"
      ]
    ],
    "prior": "registered exact rational prior",
    "private_objective": "registered private payoff or protocol control",
    "public_status": "golden",
    "reference_claims": [
      "DD-C-0040",
      "DD-C-0041"
    ],
    "reference_runs": [
      "20260721T025802Z_DD-002_73a85c71_b0e5b6dc49"
    ],
    "report_message_space": "finite registered message space",
    "reward_rule": "common discovery objective",
    "schema_version": "discoverybench-task-v2",
    "seed_policy": "no randomness beyond exact model integration",
    "social_objective": "registered discovery or net-value objective",
    "source_choice_permissions": "task-family declared source choices only",
    "source_dependence": "conditionally independent declared channels",
    "target_law": "registered finite target law",
    "task_family": "six-rule-selection-fixture",
    "task_id": "DB-G05",
    "timing": "simultaneous",
    "world_space": "finite registered world"
  },
  {
    "action_space": "finite registered search actions",
    "agent_count": 4,
    "budget": "registered finite action budget",
    "communication_permissions": "task-family declared messages only",
    "compatible_protocols": [
      "private-clue-following"
    ],
    "coverage_function": "union discovery",
    "evaluator": "exact",
    "evidence_channels": [
      "homogeneous conditionally independent sources"
    ],